{
  "published_at": "2026-10-15T17:56:36Z",
  "headline": {
    "cpi": {
      "month": "2026-09-01",
      "yoy_pct": 3.74,
      "prev_yoy_pct": 3.4,
      "as_of": "2026-10-14",
      "latest_month": "2026-09-01",
      "prev_month": "2026-08-01"
    },
    "core": {
      "month": "2026-09-01",
      "yoy_pct": 2.56,
      "prev_yoy_pct": 2.45,
      "as_of": "2026-10-14",
      "latest_month": "2026-09-01",
      "prev_month": "2026-08-01"
    },
    "pce": {
      "month": "2026-08-01",
      "yoy_pct": 3.42,
      "prev_yoy_pct": 3.36,
      "as_of": "2026-09-30",
      "latest_month": "2026-08-01",
      "prev_month": "2026-07-01"
    },
    "core_pce": {
      "month": "2026-08-01",
      "yoy_pct": 3.01,
      "prev_yoy_pct": 2.98,
      "as_of": "2026-09-30",
      "latest_month": "2026-08-01",
      "prev_month": "2026-07-01"
    }
  },
  "components": [
    {
      "code": "CUUR0000SETB01",
      "label": "Gasoline (CPI)",
      "month": "2026-09-01",
      "yoy_pct": 34.17,
      "mom_pct": 6.52
    },
    {
      "code": "CUUR0000SEHF02",
      "label": "Piped gas (CPI)",
      "month": "2026-09-01",
      "yoy_pct": 4.97,
      "mom_pct": -0.82
    },
    {
      "code": "CUUR0000SEHF01",
      "label": "Electricity (CPI)",
      "month": "2026-09-01",
      "yoy_pct": 4.37,
      "mom_pct": -0.07
    },
    {
      "code": "CUUR0000SAG",
      "label": "Other goods & services",
      "month": "2026-09-01",
      "yoy_pct": 4.15,
      "mom_pct": 0.36
    },
    {
      "code": "CUUR0000SEFV",
      "label": "Food away from home",
      "month": "2026-09-01",
      "yoy_pct": 3.46,
      "mom_pct": 0.23
    },
    {
      "code": "CUUR0000SAA",
      "label": "Apparel",
      "month": "2026-09-01",
      "yoy_pct": 3.41,
      "mom_pct": 2.41
    },
    {
      "code": "CUUR0000SEHC",
      "label": "Owners' equiv. rent",
      "month": "2026-09-01",
      "yoy_pct": 3.28,
      "mom_pct": 0.39
    },
    {
      "code": "CUUR0000SAR",
      "label": "Recreation",
      "month": "2026-09-01",
      "yoy_pct": 2.84,
      "mom_pct": 0.46
    },
    {
      "code": "CUUR0000SEHA",
      "label": "Rent",
      "month": "2026-09-01",
      "yoy_pct": 2.78,
      "mom_pct": 0.31
    },
    {
      "code": "CUUR0000SAE",
      "label": "Education & comm",
      "month": "2026-09-01",
      "yoy_pct": 2.31,
      "mom_pct": 0.4
    },
    {
      "code": "CUUR0000SAF11",
      "label": "Food at home",
      "month": "2026-09-01",
      "yoy_pct": 1.81,
      "mom_pct": 0.08
    },
    {
      "code": "CUUR0000SAM",
      "label": "Medical care",
      "month": "2026-09-01",
      "yoy_pct": 1.5,
      "mom_pct": 0.11
    },
    {
      "code": "CUUR0000SETA01",
      "label": "New vehicles",
      "month": "2026-09-01",
      "yoy_pct": 0.61,
      "mom_pct": 0.08
    },
    {
      "code": "CUUR0000SETA02",
      "label": "Used cars & trucks",
      "month": "2026-09-01",
      "yoy_pct": -1.46,
      "mom_pct": -0.1
    }
  ],
  "quotes": [
    {
      "code": "APU0000708111",
      "label": "Eggs, dozen",
      "group": "grocery",
      "unit": "$",
      "latest": 2.27,
      "obs_date": "2026-09-01",
      "yoy_pct": -34.86
    },
    {
      "code": "APU0000709112",
      "label": "Milk, gallon",
      "group": "grocery",
      "unit": "$",
      "latest": 4.11,
      "obs_date": "2026-09-01",
      "yoy_pct": -0.56
    },
    {
      "code": "APU0000702111",
      "label": "Bread, lb",
      "group": "grocery",
      "unit": "$",
      "latest": 1.83,
      "obs_date": "2026-09-01",
      "yoy_pct": -1.98
    },
    {
      "code": "APU0000703112",
      "label": "Ground beef (100%), lb",
      "group": "grocery",
      "unit": "$",
      "latest": 6.79,
      "obs_date": "2026-09-01",
      "yoy_pct": 7.42
    },
    {
      "code": "APU0000706111",
      "label": "Chicken, lb",
      "group": "grocery",
      "unit": "$",
      "latest": 2.06,
      "obs_date": "2026-09-01",
      "yoy_pct": 0.15
    },
    {
      "code": "APU0000711211",
      "label": "Bananas, lb",
      "group": "grocery",
      "unit": "$",
      "latest": 0.66,
      "obs_date": "2026-09-01",
      "yoy_pct": -2.09
    },
    {
      "code": "eia_gasreg_w",
      "label": "Gas, regular",
      "group": "energy",
      "unit": "$/gal",
      "latest": 4.33,
      "obs_date": "2026-10-12",
      "yoy_pct": 38.64
    },
    {
      "code": "eia_elec_res",
      "label": "Electricity",
      "group": "energy",
      "unit": "\u00a2/kWh",
      "latest": 18.31,
      "obs_date": "2026-07-01",
      "yoy_pct": 4.93
    },
    {
      "code": "eia_ng_res",
      "label": "Natural gas",
      "group": "energy",
      "unit": "$/Mcf",
      "latest": 26.45,
      "obs_date": "2026-07-01",
      "yoy_pct": 3.97
    },
    {
      "code": "pmms_30yr",
      "label": "30yr mortgage",
      "group": "rates",
      "unit": "%",
      "latest": 7.4,
      "obs_date": "2026-10-15",
      "yoy_pct": 17.46,
      "yoy_pp": 1.1
    },
    {
      "code": "fmp_gold",
      "label": "Gold",
      "group": "markets",
      "unit": "$/oz",
      "latest": 4174.7,
      "obs_date": "2026-10-15",
      "yoy_pct": -0.64
    },
    {
      "code": "fmp_wti",
      "label": "WTI crude",
      "group": "markets",
      "unit": "$/bbl",
      "latest": 97.86,
      "obs_date": "2026-10-15",
      "yoy_pct": 67.94
    },
    {
      "code": "fiscal_debt_total",
      "label": "Total public debt",
      "group": "fiscal",
      "unit": "$",
      "latest": 40343879238035.67,
      "obs_date": "2026-10-13",
      "yoy_pct": 6.49
    }
  ]
}
